"Subject Code","Section","Course Title","Units","Time","Room","Instructor","Max No","Lang","Level","Free Slots","Remarks","S","P"
"COMM 21","A","MEDIA AND SOCIETY","3","M-TH 0800-0930(FULLY ONSITE)","SS CSR","PARIS, Janella Grace","28","ENG","U","5","-","N","N"
"COMM 21","B","MEDIA AND SOCIETY","3","M-TH 0930-1100(FULLY ONSITE)","SS CSR","PARIS, Janella Grace","28","ENG","U","1","-","N","N"
"COMM 21","E","MEDIA AND SOCIETY","3","M-TH 1400-1530(FULLY ONSITE)","SS CSR","PARIS, Janella Grace","28","ENG","U","1","-","N","N"
"COMM 21","F","MEDIA AND SOCIETY","3","M-TH 1530-1700(FULLY ONSITE)","SS CSR","PARIS, Janella Grace","28","ENG","U","0","-","N","N"
"COMM 21","N","MEDIA AND SOCIETY","3","T-F 1400-1530(FULLY ONSITE)","SS CSR","VASWANI, SERENA M.","28","ENG","U","0","-","N","N"
"COMM 21","O","MEDIA AND SOCIETY","3","T-F 1530-1700(FULLY ONSITE)","SS CSR","VASWANI, SERENA M.","28","ENG","U","6","-","N","N"
"COMM 22","EFT","MEDIA LAW AND ETHICS","3","TH 1400-1700(FULLY ONSITE)","CTC 201C","IMBONG, JO AUREA M.","27","ENG","U","11","-","N","N"
"COMM 22","M","MEDIA LAW AND ETHICS","3","T-F 1230-1400(FULLY ONSITE)","SS CSR","ROMERO, Charlton Jules","27","ENG","U","1","-","N","N"
"COMM 22","UV2","MEDIA LAW AND ETHICS","3","SAT 1100-1400(FULLY ONSITE)","SS-280","IMBONG, JAMES M.","27","ENG","U","6","-","N","N"
"COMM 22","WX2","MEDIA LAW AND ETHICS","3","SAT 1400-1700(FULLY ONSITE)","SS-280","IMBONG, JAMES M.","27","ENG","U","1","-","N","N"
"COMM 22","YW","MEDIA LAW AND ETHICS","3","W 1700-2000(FULLY ONSITE)","SS-280","IMBONG, JO AUREA M.","0","ENG","U","-16","-","N","N"
"COMM 24","GM","SCIENCE AND RISK COMMUNICATION","3","M 1700-2000(FULLY ONSITE)","SS CONF 5","BANGABANG, Marie Antoinette","24","ENG","U","0","-","N","N"
"COMM 24","GTH1","SCIENCE AND RISK COMMUNICATION","3","TH 1700-2000(FULLY ONSITE)","SS CONF 5","BANGABANG, Marie Antoinette","24","ENG","U","0","-","N","N"
"COMM 24","M","SCIENCE AND RISK COMMUNICATION","3","T-F 1230-1400(FULLY ONSITE)","SS CONF 5","HERNANDO, Leonor","24","ENG","U","0","-","N","N"
"COMM 24","N","SCIENCE AND RISK COMMUNICATION","3","T-F 1400-1530(FULLY ONSITE)","SS CONF 5","HERNANDO, Leonor","24","ENG","U","0","-","N","N"
"COMM 24","O","SCIENCE AND RISK COMMUNICATION","3","T-F 1530-1700(FULLY ONSITE)","SS CONF 5","HERNANDO, Leonor","24","ENG","U","8","-","N","N"
"COMM 26","A","INFORMATION SOCIETY","3","M-TH 0800-0930(FULLY ONSITE)","SS-280","TY, ANDREW ALBERT J.","31","ENG","U","6","-","N","N"
"COMM 26","B","INFORMATION SOCIETY","3","M-TH 0930-1100(FULLY ONSITE)","SS-280","TY, ANDREW ALBERT J.","31","ENG","U","3","-","N","N"
"COMM 26","M","INFORMATION SOCIETY","3","T-F 1230-1400(FULLY ONSITE)","SS-280","COX, CHRISTINE ANNE R.","31","ENG","U","1","-","N","N"
"COMM 26","N","INFORMATION SOCIETY","3","T-F 1400-1530(FULLY ONSITE)","SS-280","COX, CHRISTINE ANNE R.","31","ENG","U","0","-","N","N"
"COMM 26","O","INFORMATION SOCIETY","3","T-F 1530-1700(FULLY ONSITE)","SS-280","COX, CHRISTINE ANNE R.","31","ENG","U","0","-","N","N"
"COMM 31","ST1","ADVERTISING PRACTICES AND PRINCIPLES","3","W 0800-1100(FULLY ONSITE)","SS-280","LOPEZ, CLAIRE DRUECO","25","ENG","U","4","-","N","N"
"COMM 33","ST2","ADVERTISING IN THE DIGITAL WORLD","3","SAT 0800-1100(FULLY ONSITE)","SS CONF 6","GONZALES, MANOLO P.","20","ENG","U","11","-","N","N"
"COMM 36","ST1","INTRODUCTION TO PRODUCTION (RADIO)","3","W 0800-1100(FULLY ONSITE)","SS CONF 6","PEREZ, ANNA CIELO T.","25","ENG","U","0","-","N","N"
"COMM 38","WX1","BASIC VIDEO/TV PRODUCTION TECHNIQUES","3","W 1400-1700(FULLY ONSITE)","COM STUD","TORRES, JONATHAN D.","26","ENG","U","0","-","N","N"
"COMM 41","ST1","PRODUCTION DESIGN AND MANAGEMENT","3","W 0800-1100(FULLY ONSITE)","COM STUD","VALBUENA, VICTOR T.","21","ENG","U","2","-","N","N"
"COMM 42","GM","WRITING FOR FILM","3","M 1700-2000(FULLY ONSITE)","SS CONF 6","DOMINGO, GAY ACE M.","23","ENG","U","5","-","N","N"
"COMM 44","WX2","INTRODUCTION TO GRAPHIC DESIGN","3","SAT 1400-1700(FULLY ONSITE)","SS CSR","ROBLES, Mia Noelle","20","ENG","U","0","-","N","N"
"COMM 47","F","AUDIO AND VIDEO PRODUCTION TECHNIQUES","3","M-TH 1530-1700(FULLY ONSITE)","SS CONF 5","LOPEZ, GLEN CHARLES N.","25","ENG","U","0","-","N","N"
"COMM 47","F1","AUDIO AND VIDEO PRODUCTION TECHNIQUES","3","M-TH 1530-1700(FULLY ONSITE)","SS-280","MAGONCIA, Jeremiah","35","ENG","U","0","-","N","N"
"COMM 47","ST1","AUDIO AND VIDEO PRODUCTION TECHNIQUES","3","W 0800-1100(FULLY ONSITE)","SS CONF 5","SALTARIN, PAULINE M.","25","ENG","U","0","-","N","N"
"COMM 47","WX1","AUDIO AND VIDEO PRODUCTION TECHNIQUES","3","W 1400-1700(FULLY ONSITE)","SS-280","PEREZ, ANNA CIELO T.","35","ENG","U","0","-","N","N"
"COMM 47","WX2","AUDIO AND VIDEO PRODUCTION TECHNIQUES","3","SAT 1400-1700(FULLY ONSITE)","SS CONF 5","TBA, -","25","ENG","U","0","-","N","N"
"COMM 76","M","INTRODUCTION TO JOURNALISM","3","T-F 1230-1400(FULLY ONSITE)","SS CONF 6","RIMBAN, LUZ R.","25","ENG","U","1","-","N","N"
"COMM 77","J","NEWSWRITING","3","T-F 0800-0930(FULLY ONSITE)","SS CONF 5","HOFILENA, MA. ROSARIO F.","20","ENG","U","10","ALL SLOTS FOR AB COM MAJORS.","N","N"
"COMM 78","UV1","FEATURE WRITING","3","W 1100-1400(FULLY ONSITE)","SS CONF 6","DE VERA, RUEL S.","20","ENG","U","0","-","N","N"
"COMM 85","B","ISSUES IN SCIENCE COMMUNICATION","3","M-TH 0930-1100(FULLY ONSITE)","SS CONF 6","DIMACALI, Timothy James","0","ENG","U","-11","-","N","N"
"COMM 113.03","WX1","PUBLIC RELATIONS: CREATING PR TOOLS","3","W 1400-1700(FULLY ONSITE)","SS CONF 5","SARMENTA, JR., SEVERINO R.","25","ENG","U","0","*Pre-requisite: COMM 113","N","N"
"COMM 113.04","JKA","PUBLIC RELATIONS: EVENTS MANAGEMENT","3","F 0800-1100(FULLY ONSITE)","SS-280","ARANETA, MA. SONIA R.","20","ENG","U","14","-","N","N"
"COMM 116","JK","SOCIAL MARKETING","3","T 0800-1100(ONSITE)","SS-280","CUENCO, JOSE AGUSTIN C.","20","ENG","U","0","-","N","N"
"COMM 25","C","COMMUNICATION MANAGEMENT AND ENTREPRENEURSHIP","3","M-TH 1100-1230(FULLY ONSITE)","SS-280","TEO, Eleanore","27","ENG","U","0","-","N","N"
"COMM 25","D","COMMUNICATION MANAGEMENT AND ENTREPRENEURSHIP","3","M-TH 1230-1400(FULLY ONSITE)","SS-280","TEO, Eleanore","27","ENG","U","0","-","N","N"
"COMM 25","ST2","COMMUNICATION MANAGEMENT AND ENTREPRENEURSHIP","3","SAT 0800-1100(FULLY ONSITE)","SS-280","ESPEJO, Neal Nikko","27","ENG","U","4","-","N","N"
"COMM 25","SU","COMMUNICATION MANAGEMENT AND ENTREPRENEURSHIP","3","SAT 0900-1200(ONSITE)","SS CSR","LAGDAMEO, Leslie Hans","27","ENG","U","2","-","N","N"
"COMM 180.03","UV2","SPECIAL TOPICS IN PRINT JOURNALISM: ISSUES IN JOURNALISM","3","SAT 1100-1400(FULLY ONSITE)","SS CONF 6","DE LA VEGA, LUIS FRANCISCO III D.","20","ENG","U","15","-","N","N"
"COMM 180.04","WX1","SPECIAL TOPICS IN PRINT JOURNALISM: SPORTSWRITING","3","W 1400-1700(FULLY ONSITE)","SS CONF 6","DE VERA, RUEL S.","20","ENG","U","6","-","N","N"
"COMM 182.04","UV1","SPECIAL TOPICS IN ADVERTISING:  BRANDING OPPORTUNITIES AND CHALLENGES","3","W 1100-1400(FULLY ONSITE)","SS-280","BARBIN, Maria Christina","20","ENG","U","0","-","N","N"
"COMM 182.15","GM1","SPECIAL TOPICS IN ADVERTISING: INTEGRATED MARKETING COMMUNICATIONS","3","M 1700-2000(FULLY ONSITE)","SS CSR","LOPEZ, CLAIRE DRUECO","20","ENG","U","3","-","N","N"
"COMM 183.08","E","SPECIAL TOPICS IN CULTURE AND COMMUNICATION: POETICS OF FORM IN NEW MEDIA AND LYRIC POETRY","3","M-TH 1400-1530(FULLY ONSITE)","SS-280","ELICANO, ANTONIO RAFAEL N., TY, ANDREW ALBERT J.","20","ENG","U","15","-","N","N"
"COMM 183.13","L","SPECIAL TOPICS IN CULTURE AND COMMUNICATION: THE ANTHROPOLOGY OF MEDIA","3","T-F 1100-1230(FULLY ONSITE)","SS CONF 5","LORENZANA, JOZON A.","20","ENG","U","8","-","N","N"
"COMM 186","GTH","SPECIAL TOPICS IN FILM PRODUCTION","3","TH 1700-2000(FULLY ONSITE)","SS CSR","ANG, ALEMBERG M.","20","ENG","U","5","-","N","N"
"COMM 190","A","COMMUNICATION SEMINAR: CONTEMPORARY ISSUES IN COMMUNICATION","3","M-TH 0800-0930(FULLY ONSITE)","SS CONF 5","QUE, GILBERT JACOB S.","23","ENG","U","6","-","N","N"
"COMM 190","B","COMMUNICATION SEMINAR: CONTEMPORARY ISSUES IN COMMUNICATION","3","M-TH 0930-1100(FULLY ONSITE)","SS CONF 5","VICENCIO, AARON R.","23","ENG","U","0","-","N","N"
"COMM 190","J","COMMUNICATION SEMINAR: CONTEMPORARY ISSUES IN COMMUNICATION","3","T-F 0800-0930(FULLY ONSITE)","SS CSR","QUE, GILBERT JACOB S.","23","ENG","U","0","-","N","N"
"COMM 190","K","COMMUNICATION SEMINAR: CONTEMPORARY ISSUES IN COMMUNICATION","3","T-F 0930-1100(FULLY ONSITE)","SS CSR","QUE, GILBERT JACOB S.","22","ENG","U","0","-","N","N"
"COMM 190","L","COMMUNICATION SEMINAR: CONTEMPORARY ISSUES IN COMMUNICATION","3","T-F 1100-1230(FULLY ONSITE)","SS CSR","QUE, GILBERT JACOB S.","25","ENG","U","0","-","N","N"
"COMM 191.08","UV1","FILM SEMINAR: EUROPEAN CINEMA","3","W 1100-1400(FULLY ONSITE)","SS CSR","VALBUENA, VICTOR T.","20","ENG","U","0","-","N","N"
"COMM 191.14","WX1","FILM SEMINAR:  PHILIPPINE CINEMA","3","W 1400-1700(FULLY ONSITE)","SS CSR","VALBUENA, VICTOR T.","20","ENG","U","0","-","N","N"
"COMM 191.15","ST1","FILM SEMINAR:  AMERICAN CINEMA","3","W 0800-1100(FULLY ONSITE)","SS CSR","TY, ANDREW ALBERT J.","20","ENG","U","0","-","N","N"
"COMM 193","C","QUANTITATIVE METHODS IN COMMUNICATION RESEARCH","3","M-TH 1100-1230(FULLY ONSITE)","SS CONF 5","ROMBAOA, Jasmine Sabrina","25","ENG","U","0","-","N","N"
"COMM 193","D","QUANTITATIVE METHODS IN COMMUNICATION RESEARCH","3","M-TH 1230-1400(FULLY ONSITE)","SS CONF 5","ROMBAOA, Jasmine Sabrina","25","ENG","U","2","-","N","N"
"COMM 194","A","QUALITATIVE METHODS IN COMMUNICATION RESEARCH","3","M-TH 0800-0930(FULLY ONSITE)","SS CONF 6","ROMBAOA, Jasmine Sabrina","25","ENG","U","0","-","N","N"
"COMM 194","L","QUALITATIVE METHODS IN COMMUNICATION RESEARCH","3","T-F 1100-1230(FULLY ONSITE)","SS-280","HERNANDO, Leonor","26","ENG","U","7","-","N","N"
"COMM 197","ST1","PRACTICUM","3","W 0800-1100(FULLY ONSITE)","SS-312","ROMBAOA, Jasmine Sabrina","12","ENG","U","10","ALL SLOTS FOR 4TH YEAR AB COM MAJORS.","N","N"
"COMM 199.2","C","COMMUNICATION THESIS 2","3","M-TH 1100-1230(FULLY ONSITE)","SS CONF 6","QUE, GILBERT JACOB S.","18","ENG","U","5","ALL SLOTS FOR 4TH YEAR AB COM MAJORS.","N","N"
"COMM 199.2","D","COMMUNICATION THESIS 2","3","M-TH 1230-1400(FULLY ONSITE)","SS CONF 6","TY, ANDREW ALBERT J.","14","ENG","U","2","ALL SLOTS FOR 4TH YEAR AB COM MAJORS.","N","N"
"COMM 199.2","E","COMMUNICATION THESIS 2","3","M-TH 1400-1530(FULLY ONSITE)","SS CONF 6","ROMBAOA, Jasmine Sabrina","20","ENG","U","4","ALL SLOTS FOR 4TH YEAR AB COM MAJORS.","N","N"
"COMM 199.2","K","COMMUNICATION THESIS 2","3","T-F 0930-1100(FULLY ONSITE)","SS CONF 5","LADRIDO, ESTELLE MARIE M.","15","ENG","U","3","ALL SLOTS FOR 4TH YEAR AB COM MAJORS.","N","N"
"COMM 199.2","K1","COMMUNICATION THESIS 2","3","T-F 0930-1100(FULLY ONSITE)","SS CONF 6","COX, CHRISTINE ANNE R.","13","ENG","U","0","ALL SLOTS FOR 4TH YEAR AB COM MAJORS.","N","N"
"COMM 199.2","L","COMMUNICATION THESIS 2","3","T-F 1100-1230(FULLY ONSITE)","SS CONF 6","VASWANI, SERENA M.","15","ENG","U","3","ALL SLOTS FOR 4TH YEAR AB COM MAJORS.","N","N"
"COMM 199.2","N","COMMUNICATION THESIS 2","3","T-F 1400-1530(FULLY ONSITE)","SS CONF 6","LORENZANA, JOZON A.","14","ENG","U","4","ALL SLOTS FOR 4TH YEAR AB COM MAJORS.","N","N"
"COMM 203.04","YW","PRODUCTION TECHNIQUES: VIDEO/TV PRODUCTION","3","W 1700-2000(FULLY ONSITE)","SS CONF 6","SALTARIN, PAULINE M.","12","ENG","G","11","-","N","N"
"COMM 212","ST","INTRODUCTION TO GRADUATE STUDIES IN CINEMA","3","SAT 0900-1200(ONSITE)","SS CONF 5","TEMPORAL, DENNIS O.","12","ENG","G","12","-","N","N"
"COMM 216","GM","SEMINAR:  MARKETING AND ADVERTISING","3","M 1700-2000(FULLY ONLINE)","TBA","CUENCO, JOSE AGUSTIN C.","12","ENG","G","9","-","N","N"
"COMM 292","PT","RESEARCH METHODS IN COMMUNICATION","3","T 1700-2000(FULLY ONLINE)","TBA","NASOL, CHERYL B.","12","ENG","G","8","-","N","N"
"COMM 296","COMP","COMPREHENSIVE EXAMINATIONS","0","TBA(FULLY ONSITE)","TBA","TBA, -","50","ENG","G","49","-","N","N"
"COMM 298.19","MCPPD","CAPSTONE PROJECT PROPOSAL DEFENSE","0","TBA(~)","TBA","TBA, -","50","ENG","G","50","-","N","N"
"COMM 298.66","SUB-A","SUBMISSION OF FINAL CAPSTONE PROJECT","0","TBA(~)","TBA","TBA, -","50","ENG","G","50","-","N","N"
"COMM 298.77","SUB-B","SUBMISSION OF FINAL CAPSTONE PROJECT","0","TBA(~)","TBA","TBA, -","50","ENG","G","50","-","N","N"
"COMM 298","CAPS","INDEPENDENT STUDY","3","TBA(FULLY ONSITE)","TBA","LORENZANA, JOZON A.","40","ENG","G","39","-","N","N"
"COMM 298","CAPS1","INDEPENDENT STUDY","3","TBA(FULLY ONSITE)","TBA","PONCE DE LEON, MARIA INEZ ANGELA Z., ROMBAOA, Jasmine Sabrina","40","ENG","G","40","-","N","N"
"COMM 298","CAPS2","INDEPENDENT STUDY","3","TBA(FULLY ONSITE)","TBA","SARMENTA, JR., SEVERINO R.","40","ENG","G","38","-","N","N"
"COMM 298","CAPS4","INDEPENDENT STUDY","3","TBA(FULLY ONSITE)","TBA","VALBUENA, VICTOR T.","40","ENG","G","39","-","N","N"
"COMM 299.1","THES/DISS","THESIS I","0","TBA(FULLY ONSITE)","TBA","COX, CHRISTINE ANNE R., TY, ANDREW ALBERT J.","40","ENG","G","38","-","N","N"
"COMM 299.19","TPD","THESIS PROPOSAL DEFENSE","0","TBA(~)","TBA","TBA, -","50","ENG","G","50","-","N","N"
"COMM 299.2","THES/DISS","THESIS II","0","TBA(FULLY ONSITE)","TBA","LORENZANA, JOZON A.","40","ENG","G","40","-","N","N"
"COMM 299.2","THES/DISS1","THESIS II","0","TBA(FULLY ONSITE)","TBA","PARIS, Janella Grace, PONCE DE LEON, MARIA INEZ ANGELA Z.","40","ENG","G","40","-","N","N"
"COMM 299.2","THES/DISS2","THESIS II","0","TBA(FULLY ONSITE)","TBA","PONCE DE LEON, MARIA INEZ ANGELA Z., ROMBAOA, Jasmine Sabrina","40","ENG","G","40","-","N","N"
"COMM 299.4","ODEF","ORAL DEFENSE","0","TBA(~)","TBA","TBA, -","50","ENG","G","50","-","N","N"
"COMM 299.5","RESID","RESIDENCY","0","TBA(~)","TBA","TBA, -","50","ENG","G","50","-","N","N"
"COMM 299.6","SUB-A","FINAL PAPER SUBMISSION","0","TBA(~)","TBA","TBA, -","50","ENG","G","50","-","N","N"
"COMM 299.7","SUB-B","FINAL PAPER SUBMISSION","0","TBA(~)","TBA","TBA, -","50","ENG","G","50","-","N","N"
"COMM 113","UV1","PUBLIC RELATIONS","3","W 1100-1400(FULLY ONSITE)","SS CONF 5","SARMENTA, JR., SEVERINO R.","25","ENG","U","0","-","N","N"
"JRN 296","COMP","COMPREHENSIVE EXAMINATIONS","0","TBA(~)","TBA","TBA, -","50","ENG","G","50","-","N","N"
"JRN 298.1","CAPS","MASTER'S PROJECT 1","0","TBA(~)","TBA","TBA, -","50","ENG","G","50","-","N","N"
"JRN 298.19","MCPPD","CAPSTONE PROJECT PROPOSAL DEFENSE","0","TBA(~)","TBA","TBA, -","50","ENG","G","50","-","N","N"
"JRN 298.2","CAPS","MASTER'S PROJECT 2","6","TBA(FULLY ONSITE)","TBA","BURGOS, ARLENE B., PONCE DE LEON, MARIA INEZ ANGELA Z.","40","ENG","G","39","-","N","N"
"JRN 298.2","CAPS1","MASTER'S PROJECT 2","6","TBA(FULLY ONSITE)","TBA","CRUZ, Maria Concepcion","40","ENG","G","39","-","N","N"
"JRN 298.2","CAPS10","MASTER'S PROJECT 2","6","TBA(FULLY ONSITE)","TBA","VALDEZ, VIOLET B., WONG, CHIN WAH Y.","40","ENG","G","40","-","N","N"
"JRN 298.2","CAPS2","MASTER'S PROJECT 2","6","TBA(FULLY ONSITE)","TBA","DE VERA, RUEL S., SARMENTA, JR., SEVERINO R.","40","ENG","G","39","-","N","N"
"JRN 298.2","CAPS3","MASTER'S PROJECT 2","6","TBA(FULLY ONSITE)","TBA","JAVIER, Samantha, LADRIDO, ESTELLE MARIE M.","40","ENG","G","40","-","N","N"
"JRN 298.2","CAPS4","MASTER'S PROJECT 2","6","TBA(FULLY ONSITE)","TBA","LORENZANA, JOZON A.","40","ENG","G","39","-","N","N"
"JRN 298.2","CAPS5","MASTER'S PROJECT 2","6","TBA(FULLY ONSITE)","TBA","PALACIOS, ROWENA ANTHEA A.","40","ENG","G","39","-","N","N"
"JRN 298.2","CAPS6","MASTER'S PROJECT 2","6","TBA(FULLY ONSITE)","TBA","RIMBAN, LUZ R.","40","ENG","G","39","-","N","N"
"JRN 298.2","CAPS7","MASTER'S PROJECT 2","6","TBA(FULLY ONSITE)","TBA","RIMBAN, LUZ R., VALDEZ, VIOLET B.","40","ENG","G","39","-","N","N"
"JRN 298.2","CAPS8","MASTER'S PROJECT 2","6","TBA(FULLY ONSITE)","TBA","VALBUENA, VICTOR T.","40","ENG","G","40","-","N","N"
"JRN 298.2","CAPS9","MASTER'S PROJECT 2","6","TBA(FULLY ONSITE)","TBA","SARMENTA, JR., SEVERINO R., VICENCIO, AARON R.","40","ENG","G","39","-","N","N"