Subject Code,Section,Course Title,Units,Time,Room,Instructor,Max No,Lang,Level,Free Slots,Remarks,S,P
HUMAN 141,F,INTRODUCTION TO AESTHETICS,3,"M-TH 1530-1700
(FULLY ONSITE)",CTC 205,"LORENZANA, GEORGE PETER A.",17,ENG,U,17,-,N,N
HUMAN 145,N,GREAT BOOKS I: ANCIENT PERIOD,3,"T-F 1400-1530
(FULLY ONSITE)",CTC 205,"SUNICO, RAMON VICENTE C.",10,ENG,U,10,-,N,N
HUMAN 147,M,GREAT BOOKS III: MODERN PERIOD,3,"T-F 1230-1400
(FULLY ONSITE)",CTC 205,"TBA, -",5,ENG,U,5,-,N,N
HUMAN 199.1,WX1,SENIOR SEMINAR,3,"W 1400-1700
(FULLY ONSITE)",TBA,"OFILADA, Edward Joseph",2,E / F,U,2,-,N,N
HUMAN 199.2,YW,SENIOR SEMINAR II,3,"W 1700-2000
(FULLY ONSITE)",CTC 205,"VILLANUEVA, MARTIN V.",3,FIL,U,3,*For advised and pre-enlisted AB Hum students.,N,N
IDS 121.13,J,MUSIC: THE DEVELOPMENT OF MUSIC IN WESTERN SOCIETY,3,"T-F 0800-0930
(FULLY ONSITE)",G-312A,"PASTRANA, ALLAN J.",30,ENG,U,30,5 SLOT(S) FOR AB HUM MAJORS. 5 SLOT(S) FOR AB IS MAJORS.,N,N
IDS 121.14,E,MUSIC: RUDIMENTS OF MUSIC,3,"M-TH 1400-1530
(FULLY ONSITE)",G-312A,"CAYABYAB, Antonio Maria",30,ENG,U,30,15 SLOT(S) FOR AB IS MAJORS.,N,N
IDS 121.15i,F,BASIC MUSIC RESEARCH AND CRITICISM,3,"M-TH 1530-1700
(FULLY ONSITE)",G-312A,"QUINTANA, OLIVER JOHN C.",28,ENG,U,28,7 SLOT(S) FOR AB IS MAJORS. 1 SLOT(S) FOR BFA CW MAJORS. 1 SLOT(S) FOR AB SOCIO MAJORS.,N,N
IDS 121.15i,K,BASIC MUSIC RESEARCH AND CRITICISM,3,"T-F 0930-1100
(FULLY ONSITE)",G-312A,"FRANCISCO, KAREN FATIMA R.",28,ENG,U,28,7 SLOT(S) FOR AB IS MAJORS. 1 SLOT(S) FOR CROSS REG-IXS MAJORS. 1 SLOT(S) FOR AB COM MAJORS. 1 SLOT(S) FOR BFA CW MAJORS. 1 SLOT(S) FOR BS COMTECH MAJORS.,N,N
IDS 121.15i,L,BASIC MUSIC RESEARCH AND CRITICISM,3,"T-F 1100-1230
(FULLY ONSITE)",G-312A,"FRANCISCO, KAREN FATIMA R.",28,ENG,U,28,1 SLOT(S) FOR BFA CW MAJORS. 7 SLOT(S) FOR AB IS MAJORS. 1 SLOT(S) FOR AB COM MAJORS.,N,N
IDS 121.15i,M,BASIC MUSIC RESEARCH AND CRITICISM,3,"T-F 1230-1400
(FULLY ONSITE)",G-312A,"CORONEL, ANDREI D.",28,ENG,U,28,7 SLOT(S) FOR AB IS MAJORS.,N,N
IDS 132.05i,E1,CULTURAL STUDIES OF CONTEMPORARY TECHNOLOGY,3,"M-TH 1400-1530
(FULLY ONSITE)",CTC 205,"LORENZANA, GEORGE PETER A.",28,ENG,U,28,1 SLOT(S) FOR AB COM MAJORS. 10 SLOT(S) FOR AB IS MAJORS.,N,N
IDS 133.04i,UV1,"IDEOLOGIES: GENDER AND SOCIETY IN THE PHILIPPINES - PERSPECTIVES, PROBLEMS, AND PROSPECTS",3,"W 1100-1400
(FULLY ONSITE)",CTC 205,"GUEVARA, MARITA CONCEPCION C.",28,E / F,U,28,"6 SLOT(S) FOR AB COM MAJORS. 15 SLOT(S) FOR AB IS MAJORS. 1 SLOT(S) FOR AB SOCIO MAJORS. *Some readings, videos, and guest lectures will be in Filipino.",N,N
IDS 133.05,G,"IDEOLOGIES: GENDER, ART, AND SOCIETY",3,"M-TH 1700-1830
(FULLY ONSITE)",CTC 205,"LORENZANA, GEORGE PETER A.",28,ENG,U,28,10 SLOT(S) FOR AB IS MAJORS. 3 SLOT(S) FOR CROSS REG-IXS MAJORS.,N,N
IDS 143.03,F,LITERATURE AND PHILOSOPHY: INTRODUCTION TO AESTHETICS,3,"M-TH 1530-1700
(FULLY ONSITE)",CTC 205,"LORENZANA, GEORGE PETER A.",16,ENG,U,16,1 SLOT(S) FOR AB COM MAJORS. 1 SLOT(S) FOR CROSS REG-IXS MAJORS. 14 SLOT(S) FOR AB IS MAJORS.,N,N
IDS 145,N,GREAT BOOKS I: ANCIENT PERIOD,3,"T-F 1400-1530
(FULLY ONSITE)",CTC 205,"SUNICO, RAMON VICENTE C.",20,ENG,U,20,3 SLOT(S) FOR BFA CW MAJORS.,N,N
IDS 147,M,GREAT BOOKS III: MODERN PERIOD,3,"T-F 1230-1400
(FULLY ONSITE)",CTC 205,"TBA, -",25,ENG,U,25,3 SLOT(S) FOR BFA CW MAJORS.,N,N
IDS 148,K,GREAT BOOKS IV: PHILIPPINES,3,"T-F 0930-1100
(FULLY ONSITE)",CTC 205,"COROZA, MICHAEL M.",30,FIL,U,30,"*All lectures, discussions, reports, papers will be in Filipino.",N,N
IDS 162.13i,C,MEDIA STUDIES: FILIPINO FILM AND SOCIETY,3,"M-TH 1100-1230
(FULLY ONSITE)",G-312A,"CAYABYAB, Antonio Maria",28,E / F,U,28,6 SLOT(S) FOR AB COM MAJORS. 8 SLOT(S) FOR AB IS MAJORS. 1 SLOT(S) FOR AB HUM MAJORS.,N,N
IDS 162.13i,D,MEDIA STUDIES: FILIPINO FILM AND SOCIETY,3,"M-TH 1230-1400
(FULLY ONSITE)",G-312A,"CAYABYAB, Antonio Maria",28,E / F,U,28,6 SLOT(S) FOR AB COM MAJORS. 10 SLOT(S) FOR AB IS MAJORS.,N,N
IDS 162.13i,WX1,MEDIA STUDIES: FILIPINO FILM AND SOCIETY,3,"W 1400-1700
(FULLY ONSITE)",G-312A,"CRUZ, RONALD ALLAN L.",28,E / F,U,28,6 SLOT(S) FOR AB COM MAJORS. 10 SLOT(S) FOR AB IS MAJORS.,N,N
IDS 164.05,L,SPORTS DEVELOPMENT: SPORTS AND THE ATHLETE-INTERDISCIPLINARY PERSPECTIVES,3,"T-F 1100-1230
(FULLY ONSITE)",CTC 205,"FRANCISCO, SJ, FR. JOSE MARIO C.",30,ENG,U,30,1 SLOT(S) FOR AB HUM MAJORS. 20 SLOT(S) FOR AB IS MAJORS.,N,N
IDS 165.05,ST2,DESIGN AND INNOVATION: INTRODUCTION TO THE DEVELOPMENT OF CREATIVE PROJECTS,3,"SAT 0800-1100
(FULLY ONSITE)",CTC 205,"PALILEO, AARON A.",30,ENG,U,30,20 SLOT(S) FOR AB IS MAJORS. 1 SLOT(S) FOR BFA CW MAJORS. 3 SLOT(S) FOR CROSS REG-IXS MAJORS.,N,N
IDS 165.06,L1,DESIGN AND INNOVATION: INTERDISCIPLINARY APPROACHES TO CREATIVITY AND INNOVATION,3,"T-F 1100-1230
(FULLY ONSITE)",INNOVATION 201,"INDIAS, JOI MARIE ANGELICA M.",30,ENG,U,30,15 SLOT(S) FOR AB IS MAJORS.,N,N
IDS 180.03,GM,SPECIAL TOPICS IN PHILIPPINE STUDIES: INTERPLAY- PSYCHOLOGY OF INTERPERSONAL COMMUNICATION,3,"M 1700-2000
(FULLY ONSITE)",G-312A,"ALFONSO, ALPHONSUS LUIGI E.",30,ENG,U,30,20 SLOT(S) FOR AB IS MAJORS. 1 SLOT(S) FOR AB IS MAJORS. 1 SLOT(S) FOR CROSS REG-IXS MAJORS.,N,N
IDS 180.16,B,SPECIAL TOPICS IN PHILIPPINE STUDIES: PHILIPPINE MUSIC AND CULTURE,3,"M-TH 0930-1100
(FULLY ONSITE)",G-312A,"TBA, -",30,ENG,U,30,10 SLOT(S) FOR AB IS MAJORS.,N,N
IDS 180.16,N1,SPECIAL TOPICS IN PHILIPPINE STUDIES: PHILIPPINE MUSIC AND CULTURE,3,"T-F 1400-1530
(FULLY ONSITE)",G-312A,"FRANCISCO, KAREN FATIMA R.",30,ENG,U,30,10 SLOT(S) FOR AB IS MAJORS.,N,N
IDS 180.23,F,"SPECIAL TOPICS IN PHILIPPINE STUDIES: IMAG(IN)ING HISTORY: INVENTION, INTERPRETATION, AND NARRATION",3,"M-TH 1530-1700
(FULLY ONSITE)",B-308,"OFILADA, Edward Joseph",30,ENG,U,30,15 SLOT(S) FOR AB IS MAJORS.,N,N
IDS 192,A,INTRODUCTION TO INTERDISCIPLINARY APPROACHES,3,"M-TH 0800-0930
(FULLY ONSITE)",CTC 205,"CARSI CRUZ, NIKKI B., GUEVARRA, JOSE LORENZO D.",20,E / F,U,20,*FOR PRE-ENLISTED AND ADVISED AB IS STUDENTS,N,N
IDS 192,B,INTRODUCTION TO INTERDISCIPLINARY APPROACHES,3,"M-TH 0930-1100
(FULLY ONSITE)",CTC 205,"CARSI CRUZ, NIKKI B., GUEVARRA, JOSE LORENZO D.",20,E / F,U,20,*FOR PRE-ENLISTED AND ADVISED AB IS STUDENTS,N,N
IDS 192,C,INTRODUCTION TO INTERDISCIPLINARY APPROACHES,3,"M-TH 1100-1230
(FULLY ONSITE)",CTC 205,"CARSI CRUZ, NIKKI B., GUEVARRA, JOSE LORENZO D.",20,E / F,U,20,*FOR PRE-ENLISTED AND ADVISED AB IS STUDENTS,N,N
IDS 199.1,K1,SENIOR SEMINAR I,3,"T-F 0930-1100
(FULLY ONSITE)",IS DEPT,"CRUZ, PRISCILLA ANGELA T.",13,E / F,U,13,"*For advised and pre-enlisted AB IS students. The first day of class (7 August) will be held at NGF Conference Room, located in GF Dela Costa Hall.",N,N
IDS 199.1,UV1,SENIOR SEMINAR I,3,"W 1100-1400
(FULLY ONSITE)",G-312A,"OFILADA, Edward Joseph",12,E / F,U,12,*For advised and pre-enlisted AB IS students.,N,N
IDS 199.1,UV1A,SENIOR SEMINAR I,3,"W 1100-1400
(FULLY ONSITE)",IS DEPT,"BICOMONG, Vanessa",13,E / F,U,13,*For advised and pre-enlisted students.,N,N
IDS 199.1,UV1B,SENIOR SEMINAR I,3,"W 1100-1400
(FULLY ONSITE)",TBA,"CARSI CRUZ, NIKKI B.",13,E / F,U,13,*For advised and pre-enlisted AB IS students.,N,N
IDS 199.1,WX1,SENIOR SEMINAR I,3,"W 1400-1700
(FULLY ONSITE)",TBA,"OFILADA, Edward Joseph",11,E / F,U,11,-,N,N
IDS 199.1,WX1A,SENIOR SEMINAR I,3,"W 1400-1700
(FULLY ONSITE)",CTC 205,"GUEVARA, MARITA CONCEPCION C.",13,E / F,U,13,*For advised and pre-enlisted AB IS students.,N,N
IDS 199.1,WX1B,SENIOR SEMINAR I,3,"W 1400-1700
(FULLY ONSITE)",G-206,"LABASTILLA, SKILTY C.",13,E / F,U,13,-,N,N
IDS 199.1,YW,SENIOR SEMINAR I,3,"W 1700-2000
(FULLY ONSITE)",CTC 205,"VILLANUEVA, MARTIN V.",10,E / F,U,10,*For advised and pre-enlisted AB IS students.,N,N
IDS 199.2,ZZZ,SENIOR SEMINAR II,3,"TUTORIAL 0000-0000
(FULLY ONSITE)",IS DEPT,"CARSI CRUZ, NIKKI B.",5,E / F,U,5,*For required and advised students.,N,N
